I want to go hiking and need maps,Hiking Project App
Where are the best places to hike,Hiking Project App
I want maps of hiking trails near me,Hiking Project App
I need easy trails to hike near me,Hiking Project App
Show me the shortest hiking trails,Hiking Project App
Show me single day hiking trails,Hiking Project App
I want to go backpacking,Hiking Project App
I need backpacking trails,Hiking Project App
show me the backpacking trails near me,Hiking Project App
what are the most scenic hiking trails,Hiking Project App
Hiking trails near coast line,Hiking Project App
Hiking trails in forest,Hiking Project App
Project Hiking,Hiking Project App
I want to go Climbing,Mountain Project App
What are the best rocks to climb,Mountain Project App
I want to rock climb,Mountain Project App
The Definitive Climbing Resource,Mountain Project App
ADVENTURE TO MAKE YOUR PALMS SWEAT,Mountain Project App
Rock trails to do Free solo climb,Mountain Project App
Everest climbing map,Mountain Project App
Rock Climbing Routes,Mountain Project App
Boulders to climb,Mountain Project App
People are talking about climbing mountain,Mountain Project App
Can you locate the best rock to climb,Mountain Project App
Climbing Project,Mountain Project App
Rock Climbing Project,Mountain Project App
Project Mountain,Mountain Project App
comprehensive trail database for mountain biking,MTB Project App
Next Generation MTB Trail Maps,MTB Project App
Next Generation Mountain bike Trail Maps,MTB Project App
Four Lesser-Known Destinations to Mountain Bike,MTB Project App
Everyday Essentials to Keep You Rolling on the Trail,MTB Project App
Mountain bike Trail Directory,MTB Project App
I want to find downhill trails for mountain biking,MTB Project App
I want to go Biking,MTB Project App
Where to Bike,MTB Project App
I want bike maps,MTB Project App
I need a mountain to ride,MTB Project App
There is a trail near here where the biking is really tough,MTB Project App
Project Mountain Bikes,MTB Project App
Project MTB,MTB Project App
Best parks to visit,National Parks App
Map of Yosemite National Park,National Parks App
What to do in Yellow Stone National Park,National Parks App
Maps of national Parks,National Parks App
What to do in National Parks,National Parks App
Top ten National Parks,National Parks App
I want to travel to national parks,National Parks App
There many beautiful trees in that park. I need to reserve camping spot,National Parks App
I want to go snowboarding,Powder Project App
Where are the greatest ski area,Powder Project App
Where to go sking,Powder Project App
I want to see some powder in the montains,Powder Project App
Mountains to ski,Powder Project App
Diamond route this winter season,Powder Project App
Backcountry Ski Maps & Secret Stashes,Powder Project App
Project Powder,Powder Project App
Highest Rated Featured Ski Lines,Powder Project App
Top Lines to Ski,Powder Project App
Top Lines to Snowboarding,Powder Project App
Snow shoes,Shopping
gears,Shopping
New bike,Shopping
Bike Parts,Shopping
Repair Bike,Shopping
What to bring for camping,Shopping
what to wear for camping,Shopping
I need to get some cloths,Shopping
I need a sweater,Shopping
I want to talk to someone,Shopping
I can't find anything I want,Shopping
I need help,Shopping
I want some one to help me,Shopping
This is not working. I need help,Shopping
I want to wear something for hiking,Shopping
I need only man cloths,Shopping
I want to buy ski cloths,Shopping
I want cold weather cloths,Shopping
I am feeling cold. What should I wear,Shopping
I need only woman cloths,Shopping
Where to buy women cloths,Shopping
warm cloths,Shopping
winter cloths,Shopping
rainy season cloths,Shopping
what is your contact number,Shopping
I want to run the trails,Trail Run Project App
where are the best places to run,Trail Run Project App